{
  "$schema": "./schemas/nockapp-lab-config.schema.json",
  "reportDir": ".nocklab",
  "manifest": ".nocklab/manifest.json",
  "ci": {
    "summary": ".nocklab/summary.md"
  },
  "fixtures": [
    {
      "path": "fixtures/hello-counter.lab.json",
      "slug": "hello-counter"
    },
    {
      "path": "fixtures/bridge-settlement.lab.json",
      "slug": "bridge-settlement"
    },
    {
      "path": "fixtures/bridge-delayed.lab.json",
      "slug": "bridge-delayed"
    },
    {
      "path": "fixtures/payment-flow.lab.json",
      "slug": "payment-flow"
    },
    {
      "path": "fixtures/intent-settlement.lab.json",
      "slug": "intent-settlement"
    },
    {
      "path": "fixtures/token-issuance.lab.json",
      "slug": "token-issuance"
    },
    {
      "path": "fixtures/compute-benchmark-alpha.lab.json",
      "slug": "compute-benchmark-alpha"
    },
    {
      "path": "fixtures/bridge-pack.lab.json",
      "slug": "bridge-pack"
    },
    {
      "path": "fixtures/pma-safety.lab.json",
      "slug": "pma-safety"
    },
    {
      "path": "fixtures/mining-pow.lab.json",
      "slug": "mining-pow"
    }
  ]
}
